<!ELEMENT Letter (Contact, Salutation, Paragraph, Closing, Signature)>
<!ELEMENT Contact (Name, Address, City, Pin, Flag)>
<!ATTLIST Contact type CDATA #FIXED "Sender">
<!ELEMENT Name (#PCDATA)>
<!ELEMENT Address (#PCDATA)>
<!ELEMENT City (#PCDATA)>
<!ELEMENT Pin (#PCDATA)>
<!ELEMENT Flag EMPTY>
<!ATTLIST Flag Gender (Male | Female) "Male">
<!ELEMENT Salutation (#PCDATA)>
<!ELEMENT Paragraph (#PCDATA)>
<!ELEMENT Closing (#PCDATA)>
<!ELEMENT Signature (#PCDATA)>