<?xml version="1.0" standalone="no"?>
<!DOCTYPE Letter SYSTEM "dtd/demo.dtd">
<Letter>
    <Contact type="Sender">
        <Name>Vansh</Name>
        <Address>XYZ</Address>
        <City>Ahmedabad</City>
        <Pin>777777</Pin>
        <Flag Gender="Male"></Flag>
    </Contact>
    <Salutation>
        Hello bro
    </Salutation>
    <Paragraph>
        This is a letter to you
    </Paragraph>
    <Closing>
        Thanks
    </Closing>
    <Signature>
        Vansh
    </Signature>
</Letter>